,id,comment_text,toxic,severe_toxic,obscene,threat,insult,identity_hate
527,01625cc84c6ef15b,"How do you know he is dead.  Its just his plane that crashed.  Jeezz, quit busting his nuts, folks.",0,0,1,0,0,0
1232,0350c82d1f207e0e,"Bleh. I'm all out of ideas. Is there really something wrong with the server or what? The damn thing won't work for me, either Helvetica_font_new.svg (my upload of Segoe UI was actually a PNG to begin with...)",0,0,1,0,0,0
1555,042e184200690387,"{{unblock|i said im sorry......how do u expect me to stop making accounts if u dont unblock me.....if u unblock me,ill stop making acounts...simple...........ur the ones who are making something bad to worse.....stop making a big deal...im not doing anything bad or violating anything now,so i dont get it,why am i still blocked....just get over it already.......i mean well.....im not here do violate anything.......im just trying to help.......and can someone tell alexandria to unblockme already......this block is so fucking overrated.....cant u just forgive and forget.....move on people....there are other things to worry about than a stupid block...so unblock me and MOVE ON........again,i come in peace......and i have a right to contribute to wikipedia.....what happend in the past happend....the past is in the past.....now were the present......lets open a new page and start a new chapter.....star fresh..ok..deal..??.......i promise i wont violate anything.....all im asking is another chance......one last chance.....",0,0,1,0,0,0
1697,049aa7969ccd93ff,"""

As for the arguements that abo should be included .. it already is. Wanker is used alot, but only as a common noun, and the usuage isn't unique. Same for the other words mentioned.

Though other commonwealth countries (such as new zealand) may use cunt in a similar fashion, Australians do seem to use it more. However, this arguement is irrelevent since many """"Australian"""" words such as """"mate, bloke"""" etc are used extensively in NZ, and the UK, though are still in the article.
R0m""",0,0,1,0,0,0
1888,051ef2d095a230cd,I wish to restate the AN thread as neutral and inviting community discussion. I realize that I went to far by characterizing IH as a dick. I apologize. 140.247.141.165,0,0,1,0,0,0
2593,06f0b97018548ab9,"jd2718 the sock fiend 

now hes lying out his ass on the ani page but I can't comment. and no im not this m1rth person, im just me.",0,0,1,0,0,0
3056,08429185c204220e,Ram it up ur ass very hard till ur eyes water,0,0,1,0,0,0
3610,09adcc22a0101c87,"You might try to deflate your ego a bit and stop making blanket generalizations.  The IP I use is a proxy for a university of 20,000 people, plenty of other editors (yes, Macedonians too) who use it. Sometimes I just don't notice I was logged out. Does that satisfy your sensibilities? I haven't called anyone peasant or fuck off, that is your overactive imagination playing tricks on you again.    
 As for the statement, I am simply presenting the fact that it is much more informative and encyclopedic to say the 'Macedonian National Liberation Army' liberated the city, as they were the only 'communist partisans' operating in Macedonia at that time, which you could have realized yourself by reading the article on MNLA.",0,0,1,0,0,0
4111,0af917a314be5d46,"""

 Ahem, wtf are u talking about sire? I do not practice """"vandalism"""".""",0,0,1,0,0,0
4449,0bd6ce0e0bbafd9e,"""

Yes, the money quote is that I'm fucking pissed off at the insistence of Richard James continually harrassing me, refusing to stop identifying my personal info. (as with posting my personal email above with website). I have vandalized nothing but to take a letter or two off of my personal name and words that lead to my personal info. in the slanderous and libelous and defaming posts of richard james. I don't give a shit that my project is not listed here. I found the whole process interesting and hilarious, though quite hypocritical. WHo can take the piss out of who here. THe article was about an art project, not me. I don't care that it's not there. It doesn't exist, nor does Bigfoot! His compromise was on day two of the original posting of the project article, a one man band who decides fist down who gets what and when, like a fascist pig. I could have campaigned for votes, but what the fuck...Before final vote and deletion, Richard James posted an article about me without my desire nor consent, and then deleted it in a violent fit of rage when I jokingly said the first article is dead at another's insistence that it should be deleted then at seven days. He's had the same hard-on ever since. As I said, I don't give a shit but that his posts are defaming, slanderous, libelous and outright insidious. His high and mighty accusational tone is what is weird and strange. All I have done in the past two days is to delete letters of my name and project, and the old username that I was attempting to expunge. Why?

""""Such posting can cause offence or embarrassment to the victim of the posting, not least because it means that their name, and any personal criticism or allegations made against them can then appear on web searches. If you have posted such information, please remove it immediately. Please then follow the link to this page and inform people there that the information was posted (but crucially, do not repost it on that page). An admin or developer can then remove the information from the archives of Wikipedia.""""

""""Wikipedia operates on the principle that every contributor has a right if they wish to remain completely anonymous. Wikipedia policy on that issue is strictly enforced. Posting private information about a user, specifically their (alleged) name and/or personal details, is strictly prohibited as harassment, and users who do that are often immediately blocked from editing Wikipedia."""" How is it vandalism to attempt to remain anonymous?! and to attempt to separate personal and professional reputation from libelous attacks?""",0,0,1,0,0,0
4584,0c2b0d517e954dfa,"SchtippDick 

You. You boy. Youuuuuu. Terisoaio! Yeah. Yeah. Yeah. Yeah. Yeah. Yeah. Yeah. Yeah. Yeah. Yeah. Yeah. Yeah. Yeah. Yeah. Yeah. Yeah. Yeah.",0,0,1,0,0,0
4594,0c31b95015167c1d,"I refer to people's constantly taking the words of Jimbo as policy, the idea of removing any userbox with a political point of view is his point of view.  That's at the core of this problem, you did not notice that an admin skipped over the tfd process and speedied something when there is no rule explicitly against having an opinion in a userbox?  Rather, there is Jimbo saying there shouldn't be any.  I completely understand that he started this, but he is not owner of it, a foundation was set up, perhaps you've heard of it - the Wikimedia Foundation.  I didn't say you had that same point of view, I'm saying that I was just telling the people who do to fuck off.  I made no attack on any editor, that you perceive it as such is truly sad, but such is life.  Perhaps with time you will learn the intricacies of the language.  If one does not want personal pages on a site, one should avail oneself to modify the source code in order to remove them from the site rather than complain that they're being used.  People who overstep the proper bound of their position should die, that I have encountered multiple administrators so far doing so does lead to the desire to fuck off, but I'm not done here.",0,0,1,0,0,0
4699,0c75a0479e5791fc,"Death?!?!

What utter twat said that she died on June 3rd 2008?!?!?!",0,0,1,0,0,0
6346,10f766c8502731a0,"RIAA Certifications 

Someone got that shit fucked up big, do a little research before changing the page.

http://www.riaa.com/gp/database/default.asp

Type in the artist and it says there...

PITATPOR=Gold
TLET-Platinum
MM-Platinum
BRL-Platinum
TLM-Gold",0,0,1,0,0,0
6611,11a0bd53da52af5a,"(UTC)

You never been on the damn bus,     Tlk | E-M  01:28:42, 2005-09-09",0,0,1,0,0,0
6782,12121bbe729bbf7e,"""Regarding """"personal attacks"""", I took out the disclaimer (that I had put in). I first considered copying it over to the Wikipedia Review link, as this is the same site the disclaimer referred to, but then I realized, no, that's insane! What, now we're warning people that there might be bad language and not-nice things said on a website? What the fuck? That's like warning people before reading a newspaper that there might be articles that would be """"a bummer, man; might bring you down all day"""". What is this world turning into, Disneyland, where every protruding thing that could possibly hurt you is covered in nice soft padding? Sheesh! == 

""",0,0,1,0,0,0
7661,14603e308f5970a7,"""
 Definitely have better things to do than read all that rules crap....  If I can't write it I can't write it no big whoop, it's not that important       talk #c """,0,0,1,0,0,0
7674,14687ee2dc4bbfb7,"""

 My Statement 

Oh wow, I take a little drive and come back to a nuclear war zone? I guess I can take on each point...

 The fact that MF was not blocked for the same behavior is rather odd (also... if you ask a question after telling me to stop replying... what do you really expect?).
 I agree that Tan needed to be blocked and I agree with the desysopping. 
 To say that I have no right to be angry is a foolhardy notion. I was told multiple times to fuck off (btw, when told to fuck off, I am considerably less likely to comply).
 . They both hail from the infamous Tiscali network. That being said, rpeh has no reason to be involved in this discussion (he has a personal issue with me ever since he was desysopped on another wiki; he hasn't gotten over it). I intend to request a checkuser and request a block for sockpuppetry.
 User:Georgewilliamherbert places too much weight on unofficial warnings. A vandal can be warned four times but a user once? Hmmmm...
 Prodego has no reason to be desysopped. He had every right to block for a violation of WP:NPA tens of times. 
– (talk) """,0,0,1,0,0,0
8257,15f36a0277e7fd42,"""OlYeller petulantly wrote: """"this isn't taking the conversation anywhere.""""  That's another false statement.  This conversation has corrected your false statement that there were zero indications that it was an annual event and your false statement that """"Your argument that there's a second event simply isn't true.""""  I know you don't like to be corrected.  Hey, maybe you should do another immature and emotion-based attempt to ban me, like you did a few days ago, only to realize later (after you had calmed down) that you had no basis for doing so.  Executive Summary:  Grow up, dick.  

""",0,0,1,0,0,0
8486,1689f34028702242,"""

 Love Hina part:3 

Damm you and your auto archiving!:p

Damm vandal struck again so I've left a message for Sephiroth Bcr rather then leave a message on the general board. They even removed my reference this time *angry*. Anyway, haven't done the characters yet, but what do you think of the media additions? I've only done the major works so far, there is still loads missing (color version of the manga, anime """"manga"""", characters cd's etc)   """,0,0,1,0,0,0
9545,194f1370541dcdb9,"Don't worry, tha fag Klptyzm will be blocked sooner or later.",0,0,1,0,0,0
10112,1abcdd3b4de39ae2,"""

It's a profound problem when administrators who are full of shit are allowed to even edit. The incompetence here is rather astounding. Thanks for proving my point yet again. Do you really expect me to be happy when an administrator (who has an agenda against me) blocks me? Think again. Fourth member added. – (talk) """,0,0,1,0,0,0
12061,1ff4315c2cf9dd87,"""

 Response 

I can read Japanese, as well as about 7-8 other languages, if you are interested. But no, I did not """"post"""" that reference, and please don't write in a language I assume you cannot write in. In fact, please don't live in a world I assume you should not live in.

No article is prohibited as a use for reference. Use of reference has nothing to do with copyrights. Study your books.

If sales information are unencyclopedic, I guess we should delete the List of best-selling music artists instead of discussing about it, right? We won't see them on the Japanese Wikipedia because the Japanese Wikipedia, frankly, sucks.

Take care. |heru|nar """,0,0,1,0,0,0
12954,2250ebe3581ef161,"""Kurt and Dave get it on?==

Groaning Kurt released his cock. For the past week he hadn't been able to get off. He tried a cocktail of drugs and a cocktail of whores. Nothing was doing it for him. Masturbating in the shower wasn't even working. Oh he was getting hard all right, he just couldn't fucking cum. And it was driving him nuts.

To top it off, he didn't know why he couldn't cum. The girls had been either hot enough or slutty enough. Even the couple of guys he brought home had been decent. Despite that, he couldn't fucking cum. And a week of that was enough to make anyone more pissy than normal.

Which meant band practice was unlikely to be much fun for anyone.

That was made abundantly clear the moment Kurt stepped into the rehearsal studio. His eyes flicked from Krist to Dave and he came to a sudden stop. Dave was sitting on a couch, a pretty girl in his lap giggling. It was like he was taunting Kurt. And he would have nothing of that.

Stalking over to the drummer and the floozie, Kurt pulled her forcibly out of his lap. The girl squealed and Dave growled, but Kurt paid no attention, forcing the girl out of the studio. After slamming the door he headed back over to Dave. Without a word he pulled the drummer to him and kissed him possessively.

Dave shoved Kurt away, """"What part of no don't you fucking understand!?""""

Krist's eyes widened and he took a step forward, """"Guys, I think—""""

Kurt sent him a silent glare, silencing and stopping him.

""""I don't want you, Kurt. I don't even fucking like you right now,"""" Dave growled. """"In fact, I fucking quit! I don't have to put up with this shit. You're fucking insane. You need some other crackwhore to take my place. I'm not it.""""

Sidestepping the singer, Dave headed towards the door. He barely made three steps before Kurt grabbed him again. This time his back was pulled to Kurt's front. He could clearly feel the singer's erection pressing into his ass.

He wasn't going to be anyone's bitch.

""""I'm just gonna... go,"""" Krist muttered before slipping out of the room quickly.

""""You're fucking mine, Dave,"""" Kurt declared, licking Dave's neck. """"Always.""""

For as small as he was, Kurt had more strength than Dave expected. With considerably less effort than he would have figured, the singer forced the drummer down to the floor. Dave wiggled and tried to crawl away, but all that resulted was in Kurt pulling the drummer's pants off.

Laying down on top of Dave while he worked his own pants off, Kurt hissed in his ear, """"You're mine. You hear me? Fucking mine.""""

""""Stop! Kurt, stop!"""" Dave struggled.

With Kurt's weight on him, the drummer had very little maneuverability. He was completely trapped. But that didn't mean he stopped trying to get away. While wholly his struggling was probably a good thing, it wasn't really helping. If anything it was turning Kurt on more.

Not having the patience to remove Dave's boxers, Kurt reached down and tore the back seam, exposing the drummer's ass. He didn't even pause to warn Dave. His hands spread Dave's cheeks, spit down his crack to provide some lubrication, and quickly pushed his cock in. Dave screamed, wiggling once more to get away. With Kurt's hands holding onto his hips, he had no chance to go anywhere, at least not until the singer was done.

Dave's screams faded into sobs. That alone drove Kurt further, faster. He loved everything about it. The way Dave's ass squeezed his cock better than anyone else's had before. He was a perfect glove, a perfect fit. Before too long a week's worth of unreleased cum spurted from Kurt's cock.

Slowly he pulled out, not really caring about the mixture of blood and semen leaking from Dave's ass. Grinning to himself he refastened his pants. He glanced at Dave, a feeling of superiority infusing him. He totally owned Dave now. 

Does anyone have any basis for this rumour? I would love to put it on the main page.  
Um... No. Just no. Did you pull that out of some dirty sex novel or what? Talk 

Reverted undo; suspected vandalism  
==""",0,0,1,0,0,0
13310,232f935d309d2d0a,"Information (cont.) 

Well?!? You do you want the info or not, you nasty little shit! 217.41.232.75  

 Could you stop the relentless persecution of me please? 

Bugs,

Can you have a quiet word with those two please and get them to stop claiming I'm light currant? 217.41.226.121",0,0,1,0,0,0
14260,25a45c0ecc160450,"Bullshit 

William Penn used the phrase too.  I think this is a very biased article.",0,0,1,0,0,0
14888,2757e7ed8db3e17e,"This isn't really the place to ask for this, but I'll try not to be a cunt like some of the other people who answer. 1, because it's...I dunno. Some random Wikipedia reason that cannot be explained in laymen's terms. 2, mainly because Yuke's are lazy nuggets who don't even bother to check the roster for any updates since last year. Oh, and because they've been paid. You know how it is.",0,0,1,0,0,0
15132,27f6d0317dc464dc,"Just one question
Are you actually employed by wikipedia, and therefore sanctioned to dicate what is right and wrong on this website, or just attempting to irritate as many people as possible with your one man self importance, ego inflating censorship parade? Get off your high horse and stop being such a massive cunt. With Regards, Derek James Acorah.",0,0,1,0,0,0
16766,2c38b14cbbd031a8,"""

Any chance I can get this shortened? I'll admit I acted like a dick, but I was just messing around. I don't even care that much about the issue at Chris Long, as I've been following it the past few days, and I probably wouldn't even jump back into the discussion there.►''''''Holla! """,0,0,1,0,0,0
17323,2db91d6130bcee5c,"Turns out this misinformation is due to  in terms of intelligence. It annoys me to no end when people on Wikipedia throw around claims on degrees or, even better, intelligence, and then do stupid shit like this.  Better to let your actions speak for your intelligence, or competence, I say.  (𒁳)",0,0,1,0,0,0
17787,2ef622fad03ccfd2,"Go ahead, call your friend rather than take 30 seconds to say WHAT you object to in the content. Classic abusive admin shithead behavior.",0,0,1,0,0,0
17919,2f51f61280a1930e,"""Excellent work there Shii. We can't have his kind getting us to think about what the Maya actually say about their own prophecies. We insulted him, offended him and abused him and he just had to be ethical and persistant. BLOCK those Mother Fukkers!!! Taking out the entire Santa Fe Public Library system is a great preemptive strike also. There may be others of his kind, that sympathize with those """"Indians"""". These people actually LOVE the Earth and that is without reliable sources! We kicked their asses and have the right to write THEIR history and interpret THEIR sacred teachings however we please. We need more from college students who have been indoctrinated in the Church of Academia. That piece by Stitler is one of the most exaggerated and opinionated and so yeah, use that as the title of the page! And by all means give John MAJOR Jenkins his own section. Not a single scholar or Mayanists agrees with his appropriated theory and this kind of hypocrisy and arrogance is what Wiki is all about. We can get away with it, by continuing to use our power to censor free thinkers like Mardyks and his kind. Sony Pictures is paying us all off with tickets, so let us know how many you want. FREE popcorn, too! Whoopee! Best wishes from Jimini Cricket 97.123.26.228  

""",0,0,1,0,0,0
18454,30b6fa9af54be278,"Question... 

Did POnOs ever get inserted into vagOO?",0,0,1,0,0,0
18828,31ad53bce2cb1e6d,"""

In computing, input/output, or I/O, refers to the communication between an information processing system (such as a computer), and the outside world. Inputs are the signals or data sent to the system, and outputs are the signals or data sent by the system to the outside of Nabil's Mum's Pussy. Then the dildo is placed inside it until Aleem's dad comes and ejaculates on her face while Aleem himself plucks Nabil's hair on his ass. If you would Like more information about this please call 07772550782. If he does not pick up that means he is busy with Aleem So please Leave A message.

Retrieved from """"http://en.wikipedia.org/wiki/User_talk:Dawnseeker2000""""ViewsUser page Discussion Edit this page New section History Personal toolsTry Beta Log in / create account Navigation
Main page 
Contents 
Featured content 
Current events 
Random article 
Search
     Interaction
About Wikipedia 
Community portal 
Recent changes 
Contact Wikipedia 
Donate to Wikipedia 
Help 
Toolbox
What links here 
Related changes 
User contributions 
Logs 
Upload file 
Special pages 
Printable version 
Permanent link 

This page was last modified on 19 December 2009 at 17:46. Text is available under the Creative Commons Attribution-ShareAlike License; additional terms may apply. See Terms of Use for details.
Wikipedia® is a registered trademark of the Wikimedia Foundation, Inc., a non-profit organization.Contact us Privacy policy About Wikipedia Disclaimers 

In computing, input/output, or I/O, refers to the communication between an information processing system (such as a computer), and the outside world. Inputs are the signals or data sent to the system, and outputs are the signals or data sent by the system to the outside of Nabil's Mum's Pussy. Then the dildo is placed inside it until Aleem's dad comes and ejaculates on her face while Aleem himself plucks Nabil's hair on his ass. If you would Like more information about this please call 07772550782. If he does not pick up that means he is busy with Aleem So please Leave A message.

In computing, input/output, or I/O, refers to the communication between an information processing system (such as a computer), and the outside world. Inputs are the signals or data sent to the system, and outputs are the signals or data sent by the system to the outside of Nabil's Mum's Pussy. Then the dildo is placed inside it until Aleem's dad comes and ejaculates on her face while Aleem himself plucks Nabil's hair on his ass. If you would Like more information about this please call 07772550782. If he does not pick up that means he is busy with Aleem So please Leave A message.

In computing, input/output, or I/O, refers to the communication between an information processing system (such as a computer), and the outside world. Inputs are the signals or data sent to the system, and outputs are the signals or data sent by the system to the outside of Nabil's Mum's Pussy. Then the dildo is placed inside it until Aleem's dad comes and ejaculates on her face while Aleem himself plucks Nabil's hair on his ass. If you would Like more information about this please call 07772550782. If he does not pick up that means he is busy with Aleem So please Leave A message.

In computing, input/output, or I/O, refers to the communication between an information processing system (such as a computer), and the outside world. Inputs are the signals or data sent to the system, and outputs are the signals or data sent by the system to the outside of Nabil's Mum's Pussy. Then the dildo is placed inside it until Aleem's dad comes and ejaculates on her face while Aleem himself plucks Nabil's hair on his ass. If you would Like more information about this please call 07772550782. If he does not pick up that means he is busy with Aleem So please Leave A message.

In computing, input/output, or I/O, refers to the communication between an information processing system (such as a computer), and the outside world. Inputs are the signals or data sent to the system, and outputs are the signals or data sent by the system to the outside of Nabil's Mum's Pussy. Then the dildo is placed inside it until Aleem's dad comes and ejaculates on her face while Aleem himself plucks Nabil's hair on his ass. If you would Like more information about this please call 07772550782. If he does not pick up that means he is busy with Aleem So please Leave A message.

In computing, input/output, or I/O, refers to the communication between an information processing system (such as a computer), and the outside world. Inputs are the signals or data sent to the system, and outputs are the signals or data sent by the system to the outside of Nabil's Mum's Pussy. Then the dildo is placed inside it until Aleem's dad comes and eja",0,0,1,0,0,0
19459,335d7f61fcc457a1,"""

 Comments 

""""... I stopped using my other one because of a lot of harassment and personal attacks."""": After I saw what you did, I think your second account will have the same destiny as your first one.

From this: I can't find significant coverage for this software.

What a most clueless, nut speech I've ever heard in my life. You can't find, doesn't mean It will be deleted. Sucks!   """,0,0,1,0,0,0
20476,360bd2d1494f5394,I like to tell that to students at the _beginning_ of the year. Then they can know quickly of the utter treacle that is my philosophic manifesto of righteousness. Later b|tch.,0,0,1,0,0,0
20639,36787588ecefbca7,Please keep in mind that the verifiability accuracy of the information is what is at issue here.  This is not a pissing match.,0,0,1,0,0,0
21000,37707ececa862361,DONT BREAK WP:3RR BIATCH,0,0,1,0,0,0
22090,3a3ecd9260d3f9f3,the mirror like your dad did thusly your trauma. P.S. CUNT.,0,0,1,0,0,0
