,id,comment_text,toxic,severe_toxic,obscene,threat,insult,identity_hate
107008,3c2ef0d0470e6cf4,"Make A Deal 

Why have an edit war?
My edit in Now 86
is okay of course
You are just big dicks
and now I fell so bad
This is the worst I've had
Yeah...........
Make a Deal (x3)
Yeah, yeah
Make a Deal (x3)
Yeah............

I'm called GMTV around the globe
I've been lost and have goten a great big strobe
It ain't cool
I've been a man
And now I should take over the land
I'm an only child
It so ain't fair
My parents are the only people who care
You don't understand....

Why have an edit war?
My edit in Now 86
is okay of course
You are just big dicks
and now I fell so bad
This is the worst I've had
Yeah...........
Make a Deal (x3)
Yeah, yeah
Make a Deal (x3)
Yeah............

I promise to not vandal anymore
When I think about it just gets sore
Because I don't vandalise anymore

Why have an edit war?
My edit in Now 86
is okay of course
You are just big dicks
and now I fell so bad
This is the worst I've had
Yeah...........
Make a Deal (x3)
Yeah, yeah
Make a Deal (x3)
Yeah............

Make a deal, make a deal, make a deal with me
Make a deal, make a deal, make a deal with me

Why have an edit war?
My edit in Now 86
is okay of course
You are just big dicks
and now I fell so bad
This is the worst I've had
Yeah...........
Make a Deal (x3)
Yeah, yeah
Make a Deal (x3)
Yeah............
Make a Deal (x3)
Yeah, yeah
Make a Deal (x3)
Yeah............
Make a Deal (x3)
Yeah, yeah
Make a Deal (x3)
Yeah............",0,0,1,0,0,0
107082,3c8a63f0bc67c202,"I apologize 

Look guy, I know I said some real harsh things, and I just wanna say, although you got some really weird and widely unaccepted views (i.e. races as a social construct, descent = race, British as one people, anarchy, same-sex marriage), your probably a nice guy. I am a jackass for saying some of the shit I said and ignore all the insults  about the family bro. Have a nice one, peace.",0,0,1,0,0,0
107219,3d34c9b77b0080e5,"Circumcision debate 

Jake, I've moved your debate on circumcision to a subpage of your user talk (User talk: JakeW/Circumcision debate). Talkpages of articles, even subpages, aren't meant to be Usenet-style debate forums. I don't want you to find yourself in the shit for doing that.",0,0,1,0,0,0
107249,3d4fd5e93ac46305,"""""""Heather LaCunt"""" has also been trolling the LICD forums, apparently, but can't even get her dates right and lied her ass off about the process and meetings involved in Teletoon's theft of the show idea.

""",0,0,1,0,0,0
107276,3d7251977ac396e5,"""

 Let's have a chat 

Many of us in the wikipedia community are becoming irked with your constant defense of the Administrator Veinor. Although we cannot devulge our sources there is conclusive evidence that he engages in bestiality or """"Dog Fucking"""" as some of my colleagues have come to call it. Our network's attempts to alert the wikipedia community regarding this sexual deviant have time and time again been thwarted by your efforts. I therefore ask you to cease and desist your counter-information campaign.""",0,0,1,0,0,0
108123,41e93caf80b4a946,I take it your an admin. What are you going to do about this guys racist edits. He has me pissed. I looked at his contributions they are all negative and he is trying to portray a bad image of Mid-Eastern people. I even saw racist comments.,0,0,1,0,0,0
108738,4557f575e3cb43c2,", 21 July 2006 (UTC)
Anyway, shepard can't be in this video. I fail to see how the hell an escaping prisoner ended up in some training video -_-'  10:59",0,0,1,0,0,0
108992,46c1f577e2208707,"(Damn it, I forgot to log in. -Brab)",0,0,1,0,0,0
109176,47d7fa04f3d13308,"""

Reversion of """"vandalism""""
You on the sixth of October reverted the edit we made to the articleColumbus Alternative High School (as the user , admitadly almost every edit we have ever made has been untter and blatant vandalism, however this single edit wasn't, we changed """"Advanced Placement"""" to """"Advanced Placement Program"""", a minor edit yes, but a valid one.

This is a meaningless complaint we admit, and it would not be unwarranted to ban this account immediately, however we find it annoying that you reverted our edit to an edit that had the principles name reading """"Fucking Retard"""" (this has since been reverted).

We don't know why we're even bothering complaining, and feel free to ban us, we'll deserve it eventually, but for the sake of the little credibility this shit hole has, don't do blind reversions, you never know what might be reverted.

We have fixed your mistake, that will be all. """,0,0,1,0,0,0
110290,4e0bf9d292b5765a,Clearly the mistake was mine. ) I'm just glad I wasn't an arrogant dick about it. Whew! Came thaaat close. (not true),0,0,1,0,0,0
110675,500605d1541d4dae,"Thank you, should I one day wish to yet again argue with a psychotic bitch I'll let you know. Meanwhile, please do stay off my talkpage.",0,0,1,0,0,0
111040,520e639a75b64dd3,""": I do, or rather I HAVE, edited articles without an account for quite a while. My remarks were precisely as """"antagonizing"""" as their remarks. The only difference is that I don't feel like a perpetual victim simply because I have a cunt. Just put out a sign saying you want radical feminists and that normal non-neurotic women need not apply. 70.56.26.46  

""",0,0,1,0,0,0
111814,56322d795c58c55e,"""
Hehe this is what I call """"truth hurts"""". You don't deserve to call yourself Greek as far as you don't even try to learn our goddamn holy language. And by the way, you have no right to tell me what to do. See ya around )  """,0,0,1,0,0,0
112200,583ff869addbc131,"Ciao

Whats up with that ? I thought Sonny Bonno was dead. You could very well be a man I knew from Youngstown., or perhaps Michigan. But that Ciao bullshit reminds me of Charlie.....Smith was actually directed by the California office to sell off those shops. Although many times his conversations didnt make sense leading those who knew him to surmise that he took to many blows to the head while practicing Karate. Smiths bonnuses were not that big. Dont try to call him a sapp however, as this is not something you would say to his face.....Fred Zepplin, Covington Kentucky....",0,0,1,0,0,0
112289,58a83f5f09e9eb8f,Thanks for your praise. Is there a Wikiproject for that historical atlas project you were talking about? I'll work on the next Cassell map conversion as I have time over the next few days. The biggest pain in the ass was erasing all the contemporary national borders from the giant map I found under Wikipedia:Blank maps.  (Talk) (Contrib),0,0,1,0,0,0
112534,5a09399a07fd94e2,"Nigger Hatin Me 

This is NOT a Johnnie Rebel song, but a David Allen Coe song.",0,0,1,0,0,0
113983,61b3beea5e003462,"""

John Mark Karr quote

""""You wanna rape us John Mark Karrs? You wanna rape us Debra Lafaves? Fuck you.""""  The source cited has the entire word before """"you"""" blotted out.  Is there an uncensored source, or are we just assuming it is """"fuck""""?  Although it would make the most sense from context, to be sure, we cannot make such an assumption in an encyclopedia.  Either the word should be blotted out or a reliable, first-hand, uncensored source must be added.""",0,0,1,0,0,0
114035,620a17191d970b7e,", you dummy.

The man above me is correct",0,0,1,0,0,0
114573,64cb94cac9f47b74,"""
What a crock of shit, .  That's the pissiest, poorest logic I've ever seen.  What group do you belong to?  The shortbussers?  Diligent Terrier may be a dick, but I'll say one thing for him, he's A-100% ethical and honest in all his dealings.  And I don't think he ever found himself lost in a bathroom stall, which I doubt you can claim.  To insinuate that what DT did constituted a """"personal attack"""" constitutes a huge case of self-embarrassment on your part.   It's just ridiculous.68.218.222.40  """,0,0,1,0,0,0
115636,6a6f4682aaf88202,"QUIT Threatening Me... 

Beyotch!!",0,0,1,0,0,0
115792,6b372cb5428d1154,"RE: thegodstemplate 

The text is different, looks better then the plain ass text used on everything else. And once again, who gives a shit? I use it on a few pages, what does it matter?",0,0,1,0,0,0
115913,6bc8f79725977f2b,"Hi there. In case you aren't a robot, stop sending me shit messages and instead check my edits. I am the copyright owner. You must cease and decist from distributing my content.",0,0,1,0,0,0
115928,6bd8b7fd1acf21e5,"""
I'm sorry, the term was """"fappers,"""" meaning people who enjoy masturbating to said material. Flappers would suggest you're a bit dated and twenties-ish. Maybe instead I should say that undue bias is given to those who aren't offended by pornographic material to begin with. Showing this page to the """"average person"""" generally elicits either offense or a general """"I can't believe Wikipedia..."""" in most of the cases I show it to someone else. Primetech """,0,0,1,0,0,0
118271,78002cb763af993d,STFU!!! Am I bothered?,0,0,1,0,0,0
118888,7b6b420c12edb8cb,"ocean. In the end, Michael tragically hangs himself while masturbating over his brother's dead body.",0,0,1,0,0,0
119034,7c4b108b5c5e2d27,"""
Hey, IPadPerson, please try to keep """"fuck"""" etc out of edit summaries. They're typically here to stay. Thanks.   """,0,0,1,0,0,0
119050,7c624b41f1380d4b,"I hope you like what you started 

I shouldn't have been banned. That was a complete abuse and utter bullshit. I hope you like the disruption you have caused to the project. My ban needs to be overturned so I can stop advocating for it to be undone. You guys took a dedicated editor and me out of the project just so you could keep pushing POV and free the admins to be abusive. I hope your happy. When my ban is overturned I'll walk away. But until then I a never going to stop commenting because it was abusive and never should have been allowed. Kumioko",0,0,1,0,0,0
119379,7e3ce64458ca6e65,Piss off. 67.190.81.211,0,0,1,0,0,0
120061,820958dcdbc27414,"""You never gave a concrete answer. I asked when and WHY? What do you mean a """"Lefty tradition?"""" What the hell does that mean? If you cannot give specific answers, then take""",0,0,1,0,0,0
120497,848030f6c4e0af3f,The only nonsense I will approve is nonsense committed by 1)chaka zulu warriors. 2)anglican gay priests 3)cocksuck ers,0,0,1,0,0,0
120530,84b5ff302640441e,"""
(person) (is || is not) (status), where status is an abstract concept with a non-trivial definition, is fundamentally a statement of an idea, even though a person is the subject of the sentence. Or, if you like, the proposition could be phrased as a proof: """"Wikipedians follow all five pillars; Malleus does not follow pillar 4; therefore, Malleus is not a Wikipedian"""". Contrast that to calling another editor a """"Dishonest fuck""""; even if we granted for the sake of argument that the first statement could be deduced (accuracy or inaccuracy can; dishonesty implies motive to deceive, and I have yet to see that proven), the latter is gratuitous insult.   """,0,0,1,0,0,0
120565,84f7459a433a5ab9,"Blocking user: Willybigcheese 
Hi, ummmmmm wtf is your problem, why did you block me? i didn't do anything!, please give me ur email address so I can talk to you, you douche",0,0,1,0,0,0
121578,8a7e86a0a456a678,"""

 Edit request from 71.189.212.53, 12 January 2011 

Please remove the offensive work """"fuckin"""" from the body of the text. It is a quote from a person other than Jackie Robinson, and does a dis-service to young readers. It serves no purpose and I am appalled someone allowed it for obviously uneducated reasons.

71.189.212.53  """,0,0,1,0,0,0
121774,8b7fc49d56926cff,Please unblock .75 and .252.  I can personally assure you that they will not refer to Bzuk as a Dumb Ass.68.245.223.177,0,0,1,0,0,0
122815,90f56e6f54934bfc,"""

 BULL$HIT. he sells this on openness and closes his page. u should be ashamed. 

ikipedia Founder Hit With Relationship Trouble, Allegations of Excessive Spending
By Megan McCarthy March 03, 2008 | 3:34:58 PMCategories: People  
Wikipedia founder Jimmy Wales didn't have such a good weekend. First the blogosphere and then Wikipedia itself lit up with news of his messy breakup with controversial Canadian TV pundit Rachel Marsden. Now, accusations are flying that Wales has been living the high life on the expense account of the nonprofit foundation he created.
On Friday, reports surfaced that the married-but-divorcing Internet icon carried on a clandestine affair with Marsden.  Evidence of the affair included lurid IM transcripts, which appeared on Silicon Valley gossip blog Valleywag. On Saturday, Wales posted a statement on the Wikipedia Foundations website (which he later moved to his personal site) denying that his actions went against Wikimedia Foundation's policies, and stating that the affair had ended. Marsden responded by listing the clothes that he left at her house up for auction on eBay.
So, what's the big deal when a relationship goes sour? Well, the two met when Marsden contacted Wales to help her """"clean up"""" what she perceived to be errors on her personal Wikipedia page, and there have been allegations that Wales used his influence to improperly make changes.
Former associates of Wales' are using this scandal to bring up other worries they have about the organization of the foundation. Former Wikimedia exec Danny Wool, who left the foundation last year, wrote a blog post insinuating that Wales used the non-profit foundation as his own personal piggy bank. Expenses that Wales tried to apply to the foundation included $300+ bottles of wine and visits to Moscow massage parlors, Wool alleges. According to Wool, the expenses got so out of hand that the Wikimedia foundation took away Wales' corporate credit card.
""""There were occasions where he used [the Wikimedia Foundation] for personal advancement under the guide of the mission.  And, as someone who was in there for the mission part of it, I found that rather distressful,"""" Wool told EPICENTER.
Wales did not immediately respond to a request for comment.""",0,0,1,0,0,0
122866,913fb2c1a14f5ee8,"This is stupid, but if you'll just let yourself stay blocked until it's sorted out it will be better: both for you and for Wikipedia. Please let me handle this. Trust me on this one, my fellow Mediator?  01:23, August 7, 2005 (UTC)",0,0,1,0,0,0
123184,93027cb03e1b36dc,"I believe users and attitudes like him are disruptive to the project.  Otherwise, anyone who does not bow to the collective consensus (read: me) is disruptive to the project as a matter of definition.  His arrogance, frankly, sickens me, and his attitude basically confirms my suspicion that if Ruth-2013 is right, then I have no place on Wikipedia because I don't bend over and kiss butt very well.",0,0,1,0,0,0
124010,974bbcebb6c9c8b2,"""

 Anthropogenic Heat 

I created a new article. But I'm not sure it isn't already placed somewhere else under another name? Can you guys check it out? I hope you can somehow link this Global Warming page to it, as it must be a factor. 

While you're at it, perhaps you can vandalize the shit out of it so that I can report you asshole motherfuckers! 

Also, I object to the words """"increase in the average"""" in the first sentence. I think it should read """"apparent increasse in the mean"""" as more professional scientific periodicals would. 

 ))  """,0,0,1,0,0,0
124513,9a162033a2181b2c,"""
 Ah, shit. I can't help myself. If I understand """"Hodja"""" (whose previous website id was """"Biophys"""" and is currently working some kind of deal here  if I'm following along Ok) my edits had something to do with """"the worst area of discretionary sanctions in the entire project. Other conflict areas are nothing compare (sic) to that."""" What is this area?  """,0,0,1,0,0,0
125018,9cc43e3f778c0e50,"Oh, my dumbass mistake.  It looked just like the image on your user page.  So sorry.",0,0,1,0,0,0
125389,9eae1a5192c1077d,Thanks for reading.  I appreciate it.  You should review that bullshit policy about personal attacks.  Thanks for the entertaining response.  ),0,0,1,0,0,0
125482,9f3788b942781377,"bloody hell, it continues!",0,0,1,0,0,0
125629,a00e5be26d3691e7,"EVula, answer me, got damnit!",0,0,1,0,0,0
125962,a1a95b0f8461986c,"""
 Wow, serious stick-up-the-ass-itis. But seriously, thanks for getting me blocked. Always wanted to do it. Thought it might be fun for a while, but turns out all the admins are the same variety of lame: lazy fascist. Sound familiar? Anyway, seriously, since I'm taking a (permanent?) break from Wikipedia, just leave that info here. I'm very serious about following up on that since Frank O'Hara is a subject of research in non-toilet-backwoods-punchline style research. Ya'll have fun wasting your lives on futility while the sticks up your asses keep you from having the real kind of fun you should with crap like this. But seriously, let me know where you got that O'Hara info. I'd like to follow it up (I know you'll ignore me, it's your pattern, but thought I'd give it a try  do you need reading lessons or something, it's like you have paragraphs on auto and are unable to read what others say). Anyway, just a citation or something, """"Frank O'Hara hates beats found here:"""" Citation is another shortcoming of yours, but please try. Thanks! Happy Thanksgiving!68.220.76.174  """,0,0,1,0,0,0
126160,a2a9f6026b792df3,tell your girl friend of your User:Nancy stop beenin a bitch 24 hours 86.166.250.11,0,0,1,0,0,0
126973,a70e79f99189dda5,"I had a good one up there, until some dipshit decided to change back to this joke they'd call a mosaic.   PacificWarrior101",0,0,1,0,0,0
127927,ac366ece0f39e77d,"""

Erroneous comment stricken. Still, don't delete comments outright just because you don't think they're appropriate. There's nothing in the rules that forbids casual use of words like """"fuck"""" on discussion pages. Also, what I posted above is not an attack. I mention this because one of your friends coming to your aid accused me of attacking you.""",0,0,1,0,0,0
127977,ac82efdc88b2087f,BEING SO GOD DAMN SEXY,0,0,1,0,0,0
127990,ac8f1cdda511076e,"""

 """"removing thugstep. you've already had this explained to you"""" 
One more of those 'you've already had this explained to you' tries and you'll get told about. If you suggest a thing to Thugstep article do a thing if you fucking dislike thugstep that shouldn't be a deal for wikipedia  86.57.254.215  """,0,0,1,0,0,0
128171,ad76c929f386cb5b,"""

If you are going to antagonize other people, you are going to have to learn to deal with the repercussions. As far as me calling you an """"asshole"""", If the shoe fits, wear it, !  

 vandalism of this article 
By his unwarranted removal of NON-SPAM links,  is vandalizing this article. Hey Phil, I'd like to ask that you refrain from future vandalism of this page. Failure to do so will result in me doing everything possible to have your wikipedia account blocked. By the way, isn't it foolish to use your real name as your wikipedia user name? ;-)  """,0,0,1,0,0,0
128347,ae64b4b11fc1f9d4,I think its a great idea - an bigD sounds like an asshole,0,0,1,0,0,0
128423,aecf3f843e1519ac,"""
No, I'm not joking.  I'm hoping to help BD avoid digging himself into a hole full of shite.  Really, that's what I'm doing.  I know it may be hard, but please trust me on this.  (talk …stalk!) """,0,0,1,0,0,0
128575,afa7b94735ec6307,"it becomes the primary reason why the Internet sucks.

So, wikifiddle, and wait when the party and its in reality sets in.",0,0,1,0,0,0
129038,b215dd99f022a497,"Headache Death Syndrome 

Headache Death Syndrome is what Emma has... It is a very serious headache of which makes her feel like she is going to die.

Causes: Not a clue. 
Solutions: Not a single damn thing.",0,0,1,0,0,0
130053,b7ba8da363c09298,"""
It's definitely """"[P Λ l Λ n s]"""", dear Movses. Extremely sexy """,0,0,1,0,0,0
130186,b87e9370bcc89377,"Pussy? 

Why is the term Pussy inculded in the beginning of the article?",0,0,1,0,0,0
130434,b9c14409233a5802,"Dildo Baggins 

Come on, be nice, i spent anges on dildo and even added the humour header.",0,0,1,0,0,0
131029,bd1fdacf7c53f4cf,"Do you think you would find cum shot, numa numa, or ytmnd in Britannica?",0,0,1,0,0,0
132423,c4995d224b659f1b,"""

 What!? 

I can't believe this was linked to the front page in it's present grammatical condition.  The article says """"at all costs"""" several times in the first two paragraphs alone. And as for this construction: """"The Hunger Plan may have being planned almost as soon..""""   English, mutha focker, do you speak it???""",0,0,1,0,0,0
132799,c682d96d050335c9,"""

Tell you what.  Just forget it.  Forget I ever existed.  I really can't be bothered with this bullshit.  Somebody comes tramping in, starts hackand-slash editing a sensitive article, wielding his mighty POV as the only possible truth, labels everyone who disagrees as trolls, and somehow this is OK.  He boasts of his massive donations to Wikipedia - well, if he's donated, good on him, but that shouldn't mean he should be able to make edits willy-nilly.  Look at his fucking edit history, for christ's sake.  The people he's not trying to get banned, he's trying to drive away.  Just rename it """"Merkeypedia"""" and be done with it.

I have a bunch of stuff I was going to post that's utterly non-related to Cherokees or anything Mr Merkey would even consider interesting.  If I get round to it, maybe I'll bother to log in as an anon once my IP has changed, and upload it.  If not, well, I won't.  No great loss, WP has lived without my edits until now, ad will continue to live without them tomorrow.

/pissed off rant

 """,0,0,1,0,0,0
133309,c9357a4ece3cc392,"""

Why did you alter my message? And you're calling me an arrogant, ignorant ass? Look at yourself.

I wrote that it's A PROGRESS, not IT'S IS A PROGRESS or what ever you altered it to.

And even if it's your native language it doesn't necessarily mean that you use it better than nonnative English speakers.
I still see errors in your message.

At least use I and not """"i"""".

And again, what is the point of unnecessarily adding """"Cum, leave""""?
And you're seriously just trying to argue about it, doubting MY own understanding of Hebrew and the circumstances of the title.

Again, once again, I'm telling you the reasons. In Hebrew, """"Ligmor"""" (that's the gerund. """"Gomrot"""" is a feminine present (progressive or simple) form) means either """"To finish"""" or """"To cum"""".
""""Cum"""" is obviously some sort of a slang word, but that's what Cum and Gomrot is. A word and its meaning. Because the show is about sex, their intentions for the tile are obvious. If you insistingly want that, I can put both """"Finish, Leave"""" and """"Cum, Leave"""" to show its """"double meaning"""".   """,0,0,1,0,0,0
