,id,comment_text,toxic,severe_toxic,obscene,threat,insult,identity_hate
42766,721af8ca0a8e042e,"I'm sorry I was an asshole about it.  The point is that the vowels in man and noun are raised in AusE according to Felicity Cox (2005), and the phonetic transcription for that IDEA example I gave you transcribes man as , and indeed it sounds like that to my ears, although that speaker did seem a bit broad.  It's not that uncommon for vowels to be raised before nasals.  Take for example the pin-pen merger in Southern American English and in southwestern Ireland or the non-phonemic æ-tensing that takes place in accents that have undergone the Northern cities vowel shift.  The only reason I brought this up is because I imagine it is very noticeable to English ears (it's even noticeable to my American ears).  Many English people might pronounce man as , which sounds quite a bit different from .  You're the Aussie here, so I'm sure you can verify this by simply contrasting your man with your bad (in this case both would have a long vowel, so try to listen for the quality of the vowels) or your noun with your loud.  This is just another little thing that distinguishes Aussie English from English English; that's all.",0,0,1,0,0,0
43141,731a189c3f657271,"Remember when the first nudes came out of Vanessa Hudgens?  She said her stuff was hacked, yet everybody called BS.  Same with Mily and Johansson.  But it turns out they weren't lying after all.  i also find it very interesting to see how the US Attny has apportioned the restitution.  $76K for Olstad and all her dildo shots.  $66K for Johansson and, what, one boob and an ass pic?  And $2.5K for Christina and about 5 or 6 vag shots.  Why is one Johansson boob worth $66K and all of Christina's vag shots only worth $2.5K?  I can see why Olsteads pics are worth so much.  She is smoking hot.  But one boob is hardly worth $66K.  Anyways, it will be interesting to see how it all plays out.  This kind of shit happens everyday to regular people, ex-boyfriends / girlfriends, but you don't see a year long FBI investigation out of it.",0,0,1,0,0,0
43544,7439dd70a0f8cb9b,"Bishonen
If not there, then where? NO admin cat seems to qualify. It's OK for him to cast aspersions on my front page (I appreciate technically it is Wikipedia's not mine)? It would do no good if I just blanked his and wrote crap on his. So where, then?

S",0,0,1,0,0,0
44337,766621428fd4ffe8,"""

 Tarantino 

Alright, I admit it...so I see a similarity that simplifies the entire explanation of his style by a good deal. So sue me [*shrug*]. Hell, I just thought it was easier to get this guy with Runyon in mind, y'know? Ah, well, if you decide to delete it because it wasn't some stuffed shirt in a stuffed chair on a TV show who thunk it first, I can't do anything. I've grown to be familiar with that happening, as my user talk record shows.

 

P.S.You said """"we meet again."""" I don't remember where, and so I don't know if you were one of the """"cute-but-no"""" editors or the """"you-are-fucking-crazy-get-out-before-we-send-you-a-whole-jarful-of-cookies [not the edible kind, except in small bytes ;-)]"""" editors. Please tell me, to satisfy my morbid curiousity...

Also, I need to do something for the next seventeen years of my solitary confinement...

 """,0,0,1,0,0,0
44598,772c2ee5060bdec0,"P.S., I am halfway through a sex change.  Maybe when I finally get my dick cut off I'll be a bit more relaxed.  I already have the tits, but the estogen is driving me nuts!",0,0,1,0,0,0
44821,77bef5e08832b255,"""
Probably could strike the """"You sir are a callous asshole (and I stand by that term) and nothing you do will make me believe otherwise."""" part of that statement.  The rest, while heated, I think is OK....unless anyone else doesn't and I can strike some more off it. -  • Talk • """,0,0,1,0,0,0
45242,78f69c27fd56815b,"A little clique controls the Technocracy articles to very very bad effect==
The same group of scum bag tandem editors that have controlled and now want to misrepresent any and all articles connected with Technocracy issues ... even to the point of trying to delete the article now.
http://en.wikipedia.org/wiki/User_talk:Johnfos#The_Signpost:_17_October_2011
http://en.wikipedia.org/wiki/User_talk:Epipelagic
http://en.wikipedia.org/wiki/User_talk:Beagel
http://en.wikipedia.org/wiki/User_talk:Lawrencekhoo

Mostly they collude to give bad information.
TAB
The same group of tandem editors from several years ago still try and control this article. They want to eliminate an article about one of the major social movements ... the group that started it. 
Wikipedia is known for special interest control and buddy editing. Its a pity and the reason a serious article on an important American group is being tried to be done away with by tandem editors that obviously object for some reason to the content. The past clearly shows the same team of tandem editors here.
Beagle and Johnphos are tandem editors as is Lawrencekhoo and Epipelagic... One of the most significant groups in American history and they want to get rid of the article. Its pathetic and shows the weakness of en. Wikipedia. Lawrencekhoo is a mainstream economist who ax grinds economic articles Google his name for his economic 'beliefs' Gino And fifle fool... it does not have a fucking thing to do with communism you dumb ass. Thanks

==",0,0,1,0,0,0
45718,7a35d58404e826e1,"Okay okay I see. There's a protocol. 

Oh, okay. I see how this whole things works now.

I follow ya.
  

In all my ignorant raging I completely overlooked the fact that I did not upload any of my information to the web.

HOLY CRAP I AM AN IDIOT.

But I'm an American too, so its expected to miss something.

And I'm human, so I'm expected to screw up.

Sorry m8, this whole thing could have been avoided had I taken proper introspect and gauged the situation more thoroughly

All of the 'sources' are active (just not uploaded) My apologies Holmes.

  

I thought you were just being vindictive. With the coveting of a LEviathan article which really annoys.

Everyone here though should take notice of these past four thousands edits on whatever pages I posted whatever.

Especially with this poor sods day, sorry for the headache holmes.",0,0,1,0,0,0
46588,7c7f10f967976ef6,"""

Blocking me
I dont understand you're motivation for blocking me. You say I made personal attacks and the link I followed was the Qiyamah talk page..I presume you mean my comment that Universaliss was vandalizing it. Im not sure if you were confused or simply refrained from viewing his last two edits. His last two edits were what motivated me to my accusation. He replaced the page with utter nonsense. After you blocked me you didnt even rv his vandalism! I assume your decision to block me was an accident...but it does seem suspect...especially considering your recent and persistent need to engage me in convos which really dont concern you (Woohookity and that vfd consensus). I read your comment at southerncomfort's talkpage and I think you should know that I have not mislead her as i have never talked to this user. You said you blocked universaliss for a week...do you mean you blocked him/her yesterday and this will last for a week? No matter. I simply want that user to stop 1. reverting to old-outdated versions of the page which contain grammatical and technical inaccuracies, 2. stop the personal attacks, and religious attacks (towards Protestants, Jews, and Ahmadis), 3.and stop deleting information that he/she disagrees with. I really dont think this is asking that much. In terms of diffusing the situation...I tried to add in a passage that all parties could agree to. His response was too massively delete info in various sections and add in comments like """"you fucking troll"""".  03:26, August 1, 2005 (UTC)""",0,0,1,0,0,0
47796,7fb464aae34f2d28,"""
And not arguing semantics is the last defence of someone who knows they are wrong or won't admit they are wrong. If I understand AGK correctly, he believes I was attempting to be malicious. He assumed I was saying something that I wasn't trying to. Instead of saying """"it was not constructive"""" (which is untrue and not blockable) he backed his block by implying that I meant something I did not. There are no semantics about it. AGK simply does not believe me when I say it was simple wordplay. So how about you go tell everyone in that section that it was not collaborative? It obviously was since they responded. AGK is the one who had a knee-jerk reaction to it. All that was needed was """"Dude, 'cancer' can be taken the wrong way. Strike it or get blocked."""" Instedd he waited until HOURS after I had edited to make a 24 hour block. So don;t argue semantics with me: Jusitify your poor reaction. Not punitive my ass.  01:30""",0,0,1,0,0,0
48907,82c19572d9e7be19,"Please see a picture of my balls. 

I am uninterested in your little internet power games.  You can eat a dick.  You are way late, seeing as that other dick already both berated me rudely and erased my article about my friend.  You are just pretending like your life has some meaning.",0,0,1,0,0,0
48928,82cf42b73acbcfbf,"Apparently I wasn't clear enough the first time
Well it has been a while sine I your pompous flame diety has been here. However it has come to my attention that you are not living up to our standards. In otherwords fucker you are out. You live in Paterson, New Jersey and use Verizon Internet Services Inc. 

WE ARE LEGION

WE DO NOT FORGIVE

WE DO NOT FORGET

EXPECT US 

  

Apparently I wasn't clear enough the first time
Well it has been a while sine I your pompous flame diety has been here. However it has come to my attention that you are not living up to our standards. In otherwords fucker you are out. You live in Paterson, New Jersey and use Verizon Internet Services Inc. 

WE ARE LEGION

WE DO NOT FORGIVE

WE DO NOT FORGET

EXPECT US 

  

Apparently I wasn't clear enough the first time
Well it has been a while sine I your pompous flame diety has been here. However it has come to my attention that you are not living up to our standards. In otherwords fucker you are out. You live in Paterson, New Jersey and use Verizon Internet Services Inc. 

WE ARE LEGION

WE DO NOT FORGIVE

WE DO NOT FORGET

EXPECT US 

  

Apparently I wasn't clear enough the first time
Well it has been a while sine I your pompous flame diety has been here. However it has come to my attention that you are not living up to our standards. In otherwords fucker you are out. You live in Paterson, New Jersey and use Verizon Internet Services Inc. 

WE ARE LEGION

WE DO NOT FORGIVE

WE DO NOT FORGET

EXPECT US 

  

Apparently I wasn't clear enough the first time
Well it has been a while sine I your pompous flame diety has been here. However it has come to my attention that you are not living up to our standards. In otherwords fucker you are out. You live in Paterson, New Jersey and use Verizon Internet Services Inc. 

WE ARE LEGION

WE DO NOT FORGIVE

WE DO NOT FORGET

EXPECT US",0,0,1,0,0,0
48969,82e9c4c44ec8fd6c,wtf you temp block me for?,0,0,1,0,0,0
49171,8374a0ff8c830854,"""

At the risk of stating the obvious - They're a British group, centered in Britain, comprised mostly of Brits, working for a terriably British institution and the story of the group takes place largely in Britain. Couple with this the fact that a lot of the people contributing are British, and I think you have yer answer. We could americanise it by throwing in a few cowboys and a car chase. And they can all keep calling each other """"Assholes"""". We'd have to remove any aspect of comedy from the article though. I think we could swing it though. What do you think? """,0,0,1,0,0,0
49405,841c1acb11e1e482,"""

Again, I never asserted the Greaseman's death.

Since Neturalhomer chooses to edit his User Talk page to erase the past, I will post the relevant exchange here (he gave """"removing vandalism"""" as the reason for editing it out; his only tool is a hammer, perhaps, so he sees me as a nail, perhaps)

Your Lie(s) About Me

You wrote: """"Final Warning

Saying things like """"DC101 IS HIS FUCKING EMPLOYER!!!"""" and """"Don't be a douche"""" is a good way to get blocked....fast. Tone the language down...and pay attention. Greaseman ain't dead. If you continue, to add continued, now, lies to Wikipedia, I will report you to AIV and to your ISP, Verizon. Stop now, this is your final warning. - NeutralHomer • Talk """"

Yes, I did use the language (on a talk page) and if it will make the booboo feel better, I apologize. But who doesn't enjoy a nice summer's eve?

BUT, you need to STOP LYING about me. I never said the Greaseman was dead, only that his death had been reported by sources considered reliable by Wikipedia standards. A little attention to detail on your part would be much appreciated, Eve. Otherwise, perhaps it is I who shall report you. Tell you what: you admit and retract your lie and I will consider the matter closed. Fair?

Let's look at your odd writing style: """"If you continue, to add continued, now, lies to Wikipedia,"""" Just what are you going for there?

I've never put a lie on Wikipedia, contrary to your assertion. Anyone who lies about me can go screw.

Your threat to report me to my ISP (FOR WHAT, EVE?) is beyond pathetic. Two pops for yes!! Report away.

Now, the admin who blocked me said that more than one reliable source was needed on sensitive matters.  He did not research sufficiently to reach a correct conclusion.

Let's all remember, shall we, that I never said that Greaseman was dead, simply that he was REPORTED DEAD.  There's a big difference, and the fact that it was reported is not in dispute.  I NEVER SAID GREASEMAN WAS DEAD.  Yet Neutralhomer continues to assert that I did.  THAT IS A LIE.  I consider someone lying about me a personal attack, under Wikipedia guidelines.  Is this a """"separate but equal"""" or """"separate and unequal"""" system?

The admin who blocked me wants more than one source that someone said something on the radio.  Let's look at Wikipedia's entry on Cesar Romero's personal life, shall we?  There is NO source cited for his death, nor his homosexuality, yet those are all sensitive topics, are they not?  Why doesn't Neutralhomer report the author of this page for vandalism?

The fact that Neutralhomer claims that dealing with me gave him a migraine on the talk page of the admin who blocked me demonstrates that this is a personally based effort on his part.

To recap: I never lied.  I never vandalized.  That should be enough.

Now let's look at Wikipedia's reckless report of Cesar Romero's death and homosexuality, shall we?  Sensitive matters, no?

Personal life

Romero believed in liberation theology. Romero was very Christian yet still believed in a utopian society whose belief is that Christ's kingdom would be very similar to Marx's envisionment of communism, and held to this belief until his death.[1][2]

Romero always claimed his grandfather on his mother's side was Cuban poet and patriot José Martí, although his mother's parents were legally Carmen and Manuel Mantilla with José Martí as his godfather. There was some speculation that Maria was fathered by Martí who was a boarder in the Mantilla household, but he never claimed Maria as his daughter in his lifetime.

Romero was never married, despite proposing to at least one woman. Romero made regular appearances on the Hollywood social circuit, usually in the company of an attractive actress, and he was almost always described in interviews and articles as a """"confirmed bachelor."""" Romero discussed his homosexuality in a series of interviews with author Boze Hadleigh, with the understanding that they would not be published during his lifetime.

Romero wore a man's tennis bracelet inscribed with his favorite nickname: """"Butch."""" The term was reportedly bestowed on Romero by his one-time dancing partner Joan Crawford, who teased Romero by telling him: """"You're so butch!"""" While Romero's homosexuality was an """"open secret"""" in Hollywood, the movie-going public was unaware of his sexual proclivities and there was never any embarrassing scandal surrounding his male liaisons, which shows the care and finesse with which he conducted his private life for more than 60 years.

Romero was a mainstay of the Hollywood social circuit until his death in 1994. He was interred at Inglewood",0,0,1,0,0,0
49459,843f3ab8411849c8,"""::: A book search for """"get you gone you dwarf"""" (Shakespeare's equivalent of """"fuck off, you drama-whore"""") reveals quite a few hits discussing them in depth, so I dare say something like List of Shakespearean insults does have potential.  (talk) (cont) 

""",0,0,1,0,0,0
49793,852612fd4e989abf,"As for [http://en.wikipedia.org/w/index.php?title=Becky_Gable&diff;=109346338&oldid;=109305029 this} I also just asked if he's stupid. Why? Because he keeps reverting my corrections to MY OWN MISTAKES. Tell me, how stupid is this? Rate 1-10.",0,0,1,0,0,0
50826,87e3ca1190743caa,"Find a format that works for the refernces, as [1]. [2], [3] in the middle of sentences looks fucking awfull. Use the Notes section until a better format is found for reference markers.",0,0,1,0,0,0
50851,87f63171fe2dd6ca,"""

 Another possible sock of  

There may be another sock of AFI-PUNK, and he's using a user account called . He is continually reverting my edits and restoring capitalized genres separated by line breaks (on album pages) as well as capitalizing personnel roles (""""Lead Vocals"""", """"Bass Guitar"""") when they should not be capitalized. He has continued to undo my edits after being warned by both me and another editor, saying """"THIS IS FUCKING GAY"""" in one of his reverts. I suggest a checkuser on this person. meh! """,0,0,1,0,0,0
51318,894e7a7ede74fa37,"Road Good aRticles are a pain in the ass. I've asked some one involved with the project what needs to be done with the article to take it to GA.  The history needs to be there, especially the early history which is missing.  It also needs more information on the road features, such as intersections, road width, road markings, etc. The few sources I've looked at haven't included this, and the roads people tend to use Google Maps as a source for the major intersections part.",0,0,1,0,0,0
51740,8a7217e9d04c50c5,"""

EDIT: Damn, I just lost everything I typed. Basically, 1: Not trying to promote Westside 2: Westside is not my comic. """"When he asked me to create a site about it (he's not great with these things) I of course immediately thought """"What better than Wikipedia?""""""""
3: Wikipedia is too much of a hassle, so I'll make a MySpace or something. Westside will never be good enough, I guess...""",0,0,1,0,0,0
51927,8b003bf8da83a34d,"Response

I stand by that edit. It's rude as all hell to slap very ugly templates all over an article and not even contact the author when you don't actually dispute anything in that article. I stand by everything I wrote in that article, and will happily provide sources for anything that is disputed, but I'm not going to waste my time because someone wants to be a prick.",0,0,1,0,0,0
52271,8be3050edb23f480,"Re:Mere Rubbish ==
I also think it is mere rubbish but I also think it is not completely rubbish. According to the southeast asian history, most of the ancient rulers of this region are Hindus, some rulers came from Persia (map covered Middle east, Greece, west India - Achaemenid Empire, Seleucid Empire, Parthian Empire and Sassanid Dynasty, please look at the size of the map their conquered). Kedah is a good example where the king from Persia came and eventually he built a kingdom.

In the old days, it was slavery society (no sultanate and no democracy yet), all Hindu rulers belong to higher class, common peoples and the natives belong to inferior slave class. The Hindus rulers came from India and Persia and they ruled most of the southeast asia, they called themselves high class peoples, the rest are merely slaves. Parameswara is a Hindu ruler, he is one of the descendants of the Hindu royal family that belong to higher class of Hinduism.

As for the Macedonian bloodline, this is also not completely rubbish. In the old days, the Persian empire was so big, they are so proud with king Alexander the Great. Also, they ruled some of the southeast asian lands such as the Angkor, Pasai, etc. Parameswara later married Pasai's princess and adopted Persian Shah and claimed as descendant of Alexander the Great, I don't think all this is completely rubbish.

Anyway, please correct me, I may be wrong too.  

==",0,0,1,0,0,0
52529,8c8134aef00010e6,DONT  DELETE MY POOP BRO BACK THE F UP,0,0,1,0,0,0
54243,90eed7b4b1612eae,""":congratulations, you just found something that is going on in hiphop since almost 20 years. fags? bitches? oh come on. the point is, if you use that vocabulary mentioned you dont necessarily state your view on homosexuals or women; its common used cussing, whether you like it or not. saying he is homophobic or sexist is pov and factually wrong unless you provide any interview saying him anything negative about gays, lesbians or women. in 1993, on the Home Invasion album, in the song """"99 Problems"""" (the track Jay Z bited), Ice T rapped """"(i got) a bitch who's a man because theyre bitches too"""". got it?   

""",0,0,1,0,0,0
54655,92140a8a8c065504,"""

""""Give 'em hell, Give 'em Hell, Aggies Fuck Sheep"""" has been a staple in the Texas fight lyrics the game before and during the Aggie game in the student section for as long as I have been going to the University, and as long as my brothers have been going to the University, which dates back to at least 1998, and I doubt it started then either. I have also attended every home game and OU game since 2002, and always around sections 20-24.""",0,0,1,0,0,0
